{
  "$schema": "../schema/package.schema.json",
  "slug": "grep",
  "name": "Boolsai Grep",
  "description": "Parallel regex across all Boolsai scans — discover new vendor patterns, niche signals. 4 tools.",
  "category": "mcp",
  "version": "1.0.0",
  "compatibleWith": [
    "claude",
    "codex"
  ],
  "tags": [
    "mcp",
    "streamable-http"
  ],
  "downloads": 1,
  "installHook": {
    "steps": []
  },
  "metadata": {
    "transport": "http",
    "url": "https://grep.boolsai.ai/mcp",
    "configSchema": {}
  },
  "publisher": {
    "slug": "boolsai-ai",
    "name": "Boolsai-ai",
    "tier": "community",
    "avatarUrl": "https://github.com/Boolsai-ai.png",
    "bio": null
  }
}
