{
  "$schema": "../schema/package.schema.json",
  "slug": "biel-ai",
  "name": "Biel.ai",
  "description": "Query your product docs from AI tools. Source-cited answers from your indexed documentation.",
  "category": "mcp",
  "version": "1.0.0",
  "compatibleWith": [
    "claude",
    "codex"
  ],
  "tags": [
    "mcp",
    "streamable-http"
  ],
  "downloads": 3,
  "installHook": {
    "steps": []
  },
  "metadata": {
    "transport": "http",
    "url": "https://mcp.biel.ai/v2/{project_slug}/mcp",
    "configSchema": {}
  },
  "publisher": {
    "slug": "techdocsstudio",
    "name": "TechDocsStudio",
    "tier": "community",
    "avatarUrl": "https://github.com/TechDocsStudio.png",
    "bio": null
  }
}
